title,dynasty,poet,content
暗香·旧时月色,宋代,姜夔 ,辛亥之冬，余载雪诣石湖。止既月，授简索句，且征新声，作此两曲，石湖把玩不已，使二妓肆习之，音节谐婉，乃名之曰《暗香》、《疏影》。旧时月色，算几番照我，梅边吹笛？唤起玉人，不管清寒与攀摘。何逊而今渐老，都忘却春风词笔。但怪得竹外疏花，香冷入瑶席。江国，正寂寂，叹寄与路遥，夜雪初积。翠尊易泣，红萼无言耿相忆。长记曾携手处，千树压、西湖寒碧。又片片、吹尽也，几时见得？
疏影·苔枝缀玉,宋代,姜夔 ,辛亥之冬，余载雪诣石湖。止既月，授简索句，且征新声，作此两曲，石湖把玩不已，使二妓肆习之，音节谐婉，乃名之曰《暗香》、《疏影》。苔枝缀玉，有翠禽小小，枝上同宿。客里相逢，篱角黄昏，无言自倚修竹。昭君不惯胡沙远，但暗忆、江南江北。想佩环、月夜归来，化作此花幽独。犹记深宫旧事，那人正睡里，飞近蛾绿。莫似春风，不管盈盈，早与安排金屋。还教一片随波去，又却怨、玉龙哀曲。等恁时、重觅幽香，已入小窗横幅。
风入松·一春长费买花钱,宋代,俞国宝 ,一春长费买花钱，日日醉湖边。玉骢惯识西湖路，骄嘶过、沽酒楼前。红杏香中箫鼓，绿杨影里秋千。暖风十里丽人天，花压鬓云偏。画船载取春归去，馀情付、湖水湖烟。明日重扶残醉，来寻陌上花钿。
柳梢青·岳阳楼,宋代,戴复古 ,袖剑飞吟。洞庭青草，秋水深深。万顷波光，岳阳楼上，一快披襟。不须携酒登临。问有酒、何人共斟？变尽人间，君山一点，自古如今。
减字木兰花·莎衫筠笠,宋代,卢炳 ,莎衫筠笠。正是村村农务急。绿水千畦。惭愧秧针出得齐。风斜雨细。麦欲黄时寒又至。馌妇耕夫。画作今年稔岁图。
双双燕·咏燕,宋代,史达祖 ,过春社了，度帘幕中间，去年尘冷。差池欲住，试入旧巢相并。还相雕梁藻井。又软语、商量不定。飘然快拂花梢，翠尾分开红影。芳径。芹泥雨润。爱贴地争飞，竞夸轻俊。红楼归晚，看足柳昏花暝。应自栖香正稳。便忘了、天涯芳信。愁损翠黛双蛾，日日画阑独凭。
绮罗香·咏春雨,宋代,史达祖 ,做冷欺花，将烟困柳，千里偷催春暮。尽日冥迷，愁里欲飞还住。惊粉重、蝶宿西园，喜泥润、燕归南浦。最妨它、佳约风流，钿车不到杜陵路。沉沉江上望极，还被春潮晚急，难寻官渡。隐约遥峰，和泪谢娘眉妩。临断岸、新绿生时，是落红、带愁流处。记当日、门掩梨花，剪灯深夜语。
江城子·画楼帘幕卷新晴,宋代,卢祖皋 ,画楼帘幕卷新晴。掩银屏。晓寒轻。坠粉飘香，日日唤愁生。暗数十年湖上路，能几度，著娉婷。年华空自感飘零。拥春酲。对谁醒。天阔云间，无处觅箫声。载酒买花年少事，浑不似，旧心情。
宴清都·初春,宋代,卢祖皋 ,春讯飞琼管。风日薄、度墙啼鸟声乱。江城次第，笙歌翠合，绮罗香暖。溶溶涧渌冰泮。醉梦里、年华暗换。料黛眉重锁隋堤，芳心还动梁苑。新来雁阔云音，鸾分鉴影，无计重见。啼春细雨，笼愁澹月，恁时庭院。离肠未语先断。算犹有、凭高望眼。更那堪、芳草连天，飞梅弄晚。
浪淘沙·莫上玉楼看,宋代,韩疁 ,莫上玉楼看。花雨斑斑。四垂罗幕护朝寒。燕子不知人去也，飞认阑干。回首几关山。后会应难。相逢祗有梦魂间，可奈梦随春漏短，不到江南。
霜天晓角·仪真江上夜泊,宋代,黄机 ,寒江夜宿。长啸江之曲。水底鱼龙惊动，风卷地、浪翻屋。诗情吟未足。酒兴断还续。草草兴亡休问，功名泪、欲盈掬。
玉楼春·春思,宋代,严仁 ,春风只在园西畔，荠菜花繁胡蝶乱。冰池晴绿照还空，香径落红吹已断。意长翻恨游丝短，尽日相思罗带缓。宝奁明月不欺人，明日归来君试看。
沁园春·答九华叶贤良,宋代,刘克庄 ,一卷阴符，二石硬弓，百斤宝刀。更玉花骢喷，鸣鞭电抹，乌丝阑展，醉墨龙跳。牛角书生，虬髯豪客，谈笑皆堪折简招。依稀记，曾请缨系粤，草檄征辽。当年目视云霄。谁信道凄凉今折腰。怅燕然未勒，南归草草，长安不见，北望迢迢。老去胸中，有些磊块，歌罢犹须著酒浇。休休也，但帽边鬓改，镜里颜凋。
长相思·惜梅,宋代,刘克庄 ,寒相催。暖相催。催了开时催谢时。丁宁花放迟。角声吹。笛声吹。吹了南枝吹北枝。明朝成雪飞。
贺新郎·送陈真州子华,宋代,刘克庄 ,北望神州路。试平章、这场公事，怎生分付。记得太行山百万，曾入宗爷驾驭。今把作、握蛇骑虎。君去京东豪杰喜，想投戈、下拜真吾父。谈笑里，定齐鲁。两河萧瑟惟狐兔。问当年、祖生去后，有人来否。多少新亭挥泪客，谁梦中原块土。算事业、须由人做。应笑书生心胆怯，向车中、闭置如新妇。空目送，塞鸿去。
贺新郎·九日,宋代,刘克庄 ,湛湛长空黑。更那堪、斜风细雨，乱愁如织。老眼平生空四海，赖有高楼百尺。看浩荡、千崖秋色。白发书生神州泪，尽凄凉、不向牛山滴。追往事，去无迹。少年自负凌云笔。到而今、春华落尽，满怀萧瑟。常恨世人新意少，爱说南朝狂客。把破帽、年年拈出。若对黄花孤负酒，怕黄花、也笑人岑寂。鸿北去，日西匿。
玉楼春·戏林推,宋代,刘克庄 ,年年跃马长安市。客舍似家家似寄。青钱换酒日无何，红烛呼卢宵不寐。易挑锦妇机中字。难得玉人心下事。男儿西北有神州，莫滴水西桥畔泪。
卜算子·片片蝶衣轻,宋代,刘克庄 ,片片蝶衣轻，点点猩红小。道是天公不惜花，百种千般巧。朝见树头繁，暮见枝头少。道是天公果惜花，雨洗风吹了。
一剪梅·舟过吴江,宋代,蒋捷 ,一片春愁待酒浇。江上舟摇，楼上帘招。秋娘渡与泰娘桥，风又飘飘，雨又萧萧。何日归家洗客袍？银字笙调，心字香烧。流光容易把人抛，红了樱桃，绿了芭蕉。
虞美人·听雨,宋代,蒋捷 ,少年听雨歌楼上。红烛昏罗帐。壮年听雨客舟中。江阔云低、断雁叫西风。而今听雨僧庐下。鬓已星星也。悲欢离合总无情。一任阶前、点滴到天明。
满江红·送李御带珙,宋代,吴潜 ,红玉阶前，问何事、翩然引去。湖海上、一汀鸥鹭，半帆烟雨。报国无门空自怨，济时有策从谁吐。过垂虹亭下系扁舟，鲈堪煮。拚一醉，留君住。歌一曲，送君路。遍江南江北，欲归何处。世事悠悠浑未了，年光冉冉今如许。试举头、一笑问青天，天无语。
江城子·示表侄刘国华,宋代,吴潜 ,家园十亩屋头边。正春妍，酿花天。杨柳多情，拂拂带轻烟。别馆闲亭随分有，时策杖，小盘旋。采山钓水美而鲜。饮中仙，醉中禅。闲处光阴，赢得日高眠。一品高官人道好，多少事，碎心田。
蓦山溪·自述,宋代,宋自逊 ,壶山居士，未老心先懒。爱学道人家，办竹几、蒲团茗碗。青山可买，小结屋三间，开一径，俯清溪，修竹栽教满。客来便请，随分家常饭。若肯小留连，更薄酒，三杯两盏，吟诗度曲，风月任招呼。身外事，不关心，自有天公管。
谒金门·花过雨,宋代,李好古 ,花过雨，又是一番红素。燕子归来愁不语，旧巢无觅处。谁在玉关劳苦？谁在玉楼歌舞？若使胡尘吹得去，东风侯万户。
青玉案·年年社日停针线,宋代,黄公绍 ,年年社日停针线。怎忍见、双飞燕。今日江城春已半。一身犹在，乱山深处，寂寞溪桥畔。春衫著破谁针线。点点行行泪痕满。落日解鞍芳草岸。花无人戴，酒无人劝，醉也无人管。
湘春夜月·近清明,宋代,黄孝迈 ,近清明。翠禽枝上消魂。可惜一片清歌，都付与黄昏。欲共柳花低诉，怕柳花轻薄，不解伤春。念楚乡旅宿，柔情别绪，谁与温存。空樽夜泣，青山不语，残月当门。翠玉楼前，惟是有、一波湘水，摇荡湘云。天长梦短，问甚时、重见桃根。这次第，算人间没个并刀，剪断心上愁痕。
长相思·花深深,宋代,陈东甫 ,花深深。柳阴阴。度柳穿花觅信音。君心负妾心。怨呜琴。恨孤衾。钿誓钗盟何处寻。当初谁料今。
水调歌头·平山堂用东坡韵,宋代,方岳 ,秋雨一何碧，山色倚晴空。江南江北愁思，分付酒螺红。芦叶蓬舟千重，菰菜莼羹一梦，无语寄归鸿。醉眼渺河洛，遗恨夕阳中。苹洲外，山欲暝，敛眉峰。人间俯仰陈迹，叹息两仙翁。不见当时杨柳，只是从前烟雨，磨灭几英雄。天地一孤啸，匹马又西风。
浣溪沙·门隔花深梦旧游,宋代,吴文英 ,门隔花深梦旧游。夕阳无语燕归愁。玉纤香动小帘钩。落絮无声春堕泪，行云有影月含羞。东风临夜冷于秋。
风入松·听风听雨过清明,宋代,吴文英 ,听风听雨过清明。愁草瘗花铭。楼前绿暗分携路，一丝柳、一寸柔情。料峭春寒中酒，交加晓梦啼莺。西园日日扫林亭。依旧赏新晴。黄蜂频扑秋千索，有当时、纤手香凝。惆怅双鸳不到，幽阶一夜苔生。
莺啼序·春晚感怀,宋代,吴文英 ,残寒正欺病酒，掩沉香绣户。燕来晚、飞入西城，似说春事迟暮。画船载、清明过却，晴烟冉冉吴宫树。念羁情、游荡随风，化为轻絮。　　十载西湖，傍柳系马，趁娇尘软雾。溯红渐招入仙溪，锦儿偷寄幽素，倚银屏、春宽梦窄，断红湿、歌纨金缕。暝堤空，轻把斜阳，总还鸥鹭。　　幽兰旋老，杜若还生，水乡尚寄旅。别后访、六桥无信，事往花委，瘗玉埋香，几番风雨。长波妒盼，遥山羞黛，渔灯分影春江宿。记当时、短楫桃根渡，青楼仿佛，临分败壁题诗，泪墨惨淡尘土。危亭望极，草色天涯，叹鬓侵半苎。暗点检、离痕欢唾，尚染鲛绡，亸凤迷归，破鸾慵舞。殷勤待写，书中长恨，蓝霞辽海沉过雁。漫相思、弹入哀筝柱。伤心千里江南，怨曲重招，断魂在否？
八声甘州·灵岩陪庾幕诸公游,宋代,吴文英 ,渺空烟四远，是何年、青天坠长星？幻苍崖云树，名娃金屋，残霸宫城。箭径酸风射眼，腻水染花腥。时靸双鸳响，廊叶秋声。宫里吴王沉醉，倩五湖倦客，独钓醒醒。问苍波无语，华发奈山青。水涵空、阑干高处，送乱鸦斜日落渔汀。连呼酒、上琴台去，秋与云平。
唐多令·惜别,宋代,吴文英 ,何处合成愁。离人心上秋。纵芭蕉、不雨也飕飕。都道晚凉天气好，有明月、怕登楼。年事梦中休。花空烟水流。燕辞归、客尚淹留。垂柳不萦裙带住。漫长是、系行舟。
清平乐·宫怨,宋代,黄升 ,珠帘寂寂。愁背银缸泣。记得少年初选入。三十六宫第一。当年掌上承恩。而今冷落长门。又是羊车过也，月明花落黄昏。
贺新郎·西湖,宋代,文及翁 ,一勺西湖水。渡江来，百年歌舞，百年酣醉。回首洛阳花石尽，烟渺黍离之地。更不复、新亭堕泪。簇乐红妆摇画舫，问中流、击楫何人是？千古恨，几时洗？余生自负澄清志。更有谁、磻溪未遇，傅岩未起。国事如今谁倚仗，衣带一江而已！便都道、江神堪恃。借问孤山林处士，但掉头、笑指梅花蕊。天下事，可知矣！
西江月·新秋写兴,宋代,刘辰翁 ,天上低昂似旧，人间儿女成狂。夜来处处试新妆。却是人间天上。不觉新凉似水，相思两鬓如霜。梦从海底跨枯桑。阅尽银河风浪。
兰陵王·丙子送春,宋代,刘辰翁 ,送春去。春去人间无路。秋千外，芳草连天，谁遣风沙暗南浦。依依甚意绪。漫忆海门飞絮。乱鸦过，斗转城荒，不见来时试灯处。春去。最谁苦。但箭雁沉边，梁燕无主。杜鹃声里长门暮。想玉树凋土，泪盘如露。咸阳送客屡回顾。斜日未能度。春去。尚来否。正江令恨别，庾信愁赋。二人皆北去。苏堤尽日风和雨。叹神游故国，花记前度。人生流落，顾孺子，共夜语。
满江红·题南京夷山驿,宋代,王清惠 ,太液芙蓉，浑不似、旧时颜色。曾记得、春风雨露，玉楼金阙。名播兰馨妃后里，晕潮莲脸君王侧。忽一声、鼙鼓揭天来，繁华歇。龙虎散，风云灭。千古恨，凭谁说。对山河百二，泪盈襟血。客馆夜惊尘土梦，宫车晓碾关山月。问嫦娥、于我肯从容，同圆缺？
八声甘州·记玉关踏雪事清游,宋代,张炎 ,辛卯岁，沈尧道同余北归，各处杭、越。逾岁，尧道来问寂寞，语笑数日。又复别去。赋此曲，并寄赵学舟。记玉关踏雪事清游，寒气脆貂裘。傍枯林古道，长河饮马，此意悠悠。短梦依然江表，老泪洒西州。一字无题处，落叶都愁。载取白云归去，问谁留楚佩，弄影中洲？折芦花赠远，零落一身秋。向寻常、野桥流水，待招来，不是旧沙鸥。空怀感，有斜阳处，却怕登楼。
清平乐·候蛩凄断,宋代,张炎 ,候蛩凄断，人语西风岸。月落沙平江似练，望尽芦花无雁。暗教愁损兰成，可怜夜夜关情。只有一枝梧叶，不知多少秋声！
水调歌头·明月几时有,宋代,苏轼 ,丙辰中秋，欢饮达旦，大醉，作此篇，兼怀子由。明月几时有？把酒问青天。不知天上宫阙，今夕是何年。我欲乘风归去，又恐琼楼玉宇，高处不胜寒。起舞弄清影，何似在人间？转朱阁，低绮户，照无眠。不应有恨，何事长向别时圆？人有悲欢离合，月有阴晴圆缺，此事古难全。但愿人长久，千里共婵娟。
卜算子·咏梅,宋代,陆游 ,驿外断桥边，寂寞开无主。已是黄昏独自愁，更著风和雨。无意苦争春，一任群芳妒。零落成泥碾作尘，只有香如故。
声声慢·寻寻觅觅,宋代,李清照 ,寻寻觅觅，冷冷清清，凄凄惨惨戚戚。乍暖还寒时候，最难将息。三杯两盏淡酒，怎敌他、晚来风急？雁过也，正伤心，却是旧时相识。满地黄花堆积。憔悴损，如今有谁堪摘？守着窗儿，独自怎生得黑？梧桐更兼细雨，到黄昏、点点滴滴。这次第，怎一个愁字了得！
武陵春·春晚,宋代,李清照 ,风住尘香花已尽，日晚倦梳头。物是人非事事休，欲语泪先流。闻说双溪春尚好，也拟泛轻舟。只恐双溪舴艋舟，载不动许多愁。
雨霖铃·寒蝉凄切,宋代,柳永 ,寒蝉凄切，对长亭晚，骤雨初歇。都门帐饮无绪，留恋处，兰舟催发。执手相看泪眼，竟无语凝噎。念去去，千里烟波，暮霭沉沉楚天阔。多情自古伤离别，更那堪，冷落清秋节！今宵酒醒何处？杨柳岸，晓风残月。此去经年，应是良辰好景虚设。便纵有千种风情，更与何人说？
浣溪沙·一曲新词酒一杯,宋代,晏殊 ,一曲新词酒一杯，去年天气旧亭台。夕阳西下几时回？无可奈何花落去，似曾相识燕归来。小园香径独徘徊。
如梦令·常记溪亭日暮,宋代,李清照 ,常记溪亭日暮，沉醉不知归路。兴尽晚回舟，误入藕花深处。争渡，争渡，惊起一滩鸥鹭。
一剪梅·红藕香残玉簟秋,宋代,李清照 ,红藕香残玉簟秋。轻解罗裳，独上兰舟。云中谁寄锦书来，雁字回时，月满西楼。花自飘零水自流。一种相思，两处闲愁。此情无计可消除，才下眉头，却上心头。
如梦令·昨夜雨疏风骤,宋代,李清照 ,昨夜雨疏风骤，浓睡不消残酒。试问卷帘人，却道海棠依旧。知否，知否？应是绿肥红瘦。
鹊桥仙·纤云弄巧,宋代,秦观 ,纤云弄巧，飞星传恨，银汉迢迢暗度。金风玉露一相逢，便胜却人间无数。柔情似水，佳期如梦，忍顾鹊桥归路。两情若是久长时，又岂在朝朝暮暮。
醉花阴·薄雾浓云愁永昼,宋代,李清照 ,薄雾浓云愁永昼，瑞脑消金兽。佳节又重阳，玉枕纱橱，半夜凉初透。东篱把酒黄昏后，有暗香盈袖。莫道不销魂，帘卷西风，人比黄花瘦。
丑奴儿·书博山道中壁,宋代,辛弃疾 ,少年不识愁滋味，爱上层楼。爱上层楼。为赋新词强说愁。而今识尽愁滋味，欲说还休。欲说还休。却道天凉好个秋。
苏幕遮·怀旧,宋代,范仲淹 ,碧云天，黄叶地。秋色连波，波上寒烟翠。山映斜阳天接水。芳草无情，更在斜阳外。黯乡魂，追旅思。夜夜除非，好梦留人睡。明月楼高休独倚。酒入愁肠，化作相思泪。
钗头凤·红酥手,宋代,陆游 ,红酥手，黄縢酒，满城春色宫墙柳。东风恶，欢情薄。一怀愁绪，几年离索。错、错、错。春如旧，人空瘦，泪痕红浥鲛绡透。桃花落，闲池阁。山盟虽在，锦书难托。莫、莫、莫！
卜算子·我住长江头,宋代,李之仪 ,我住长江头，君住长江尾。日日思君不见君，共饮长江水。此水几时休，此恨何时已。只愿君心似我心，定不负相思意。
蝶恋花·庭院深深深几许,宋代,欧阳修 ,庭院深深深几许，杨柳堆烟，帘幕无重数。玉勒雕鞍游冶处，楼高不见章台路。雨横风狂三月暮，门掩黄昏，无计留春住。泪眼问花花不语，乱红飞过秋千去。
渔家傲·天接云涛连晓雾,宋代,李清照 ,天接云涛连晓雾，星河欲转千帆舞。仿佛梦魂归帝所。闻天语，殷勤问我归何处。我报路长嗟日暮，学诗谩有惊人句。九万里风鹏正举。风休住，蓬舟吹取三山去！
生查子·元夕,宋代,欧阳修 ,去年元夜时，花市灯如昼。月上柳梢头，人约黄昏后。今年元夜时，月与灯依旧。不见去年人，泪湿春衫袖。
诉衷情·当年万里觅封侯,宋代,陆游 ,当年万里觅封侯，匹马戍梁州。关河梦断何处？尘暗旧貂裘。胡未灭，鬓先秋，泪空流。此生谁料，心在天山，身老沧洲。
钗头凤·世情薄,宋代,唐婉 ,世情薄，人情恶，雨送黄昏花易落。晓风干，泪痕残。欲笺心事，独语斜阑。难，难，难！人成各，今非昨，病魂常似秋千索。角声寒，夜阑珊。怕人寻问，咽泪装欢。瞒，瞒，瞒！
水龙吟·登建康赏心亭,宋代,辛弃疾 ,楚天千里清秋，水随天去秋无际。遥岑远目，献愁供恨，玉簪螺髻。落日楼头，断鸿声里，江南游子。把吴钩看了，栏杆拍遍，无人会，登临意。休说鲈鱼堪脍，尽西风，季鹰归未？求田问舍，怕应羞见，刘郎才气。可惜流年，忧愁风雨，树犹如此！倩何人唤取，红巾翠袖，揾英雄泪！
虞美人·听雨,宋代,蒋捷 ,少年听雨歌楼上。红烛昏罗帐。壮年听雨客舟中。江阔云低、断雁叫西风。而今听雨僧庐下。鬓已星星也。悲欢离合总无情。一任阶前、点滴到天明。
阳关曲·中秋月,宋代,苏轼 ,中秋作本名小秦王，入腔即阳关曲暮云收尽溢清寒，银汉无声转玉盘。此生此夜不长好，明月明年何处看。
清平乐·年年雪里,宋代,李清照 ,年年雪里，常插梅花醉。挼尽梅花无好意，赢得满衣清泪。今年海角天涯，萧萧两鬓生华。看取晚来风势，故应难看梅花。
西江月·世事一场大梦,宋代,苏轼 ,世事一场大梦，人生几度秋凉？夜来风叶已鸣廊。看取眉头鬓上。酒贱常愁客少，月明多被云妨。中秋谁与共孤光。把盏凄然北望。
水龙吟·次韵章质夫杨花词,宋代,苏轼 ,似花还似非花，也无人惜从教坠。抛家傍路，思量却是，无情有思。萦损柔肠，困酣娇眼，欲开还闭。梦随风万里，寻郎去处，又还被、莺呼起。不恨此花飞尽，恨西园、落红难缀。晓来雨过，遗踪何在？一池萍碎。春色三分，二分尘土，一分流水。细看来，不是杨花，点点是离人泪。
临江仙·梦后楼台高锁,宋代,晏几道 ,梦后楼台高锁，酒醒帘幕低垂。去年春恨却来时。落花人独立，微雨燕双飞。记得小蘋初见，两重心字罗衣。琵琶弦上说相思。当时明月在，曾照彩云归。
点绛唇·蹴罢秋千,宋代,李清照 ,蹴罢秋千，起来慵整纤纤手。露浓花瘦，薄汗轻衣透。见客入来，袜刬金钗溜。和羞走，倚门回首，却把青梅嗅。
小重山·昨夜寒蛩不住鸣,宋代,岳飞 ,昨夜寒蛩不住鸣。惊回千里梦，已三更。起来独自绕阶行。人悄悄，帘外月胧明。白首为功名。旧山松竹老，阻归程。欲将心事付瑶琴。知音少，弦断有谁听。
玉楼春·尊前拟把归期说,宋代,欧阳修 ,尊前拟把归期说，欲语春容先惨咽。人生自是有情痴，此恨不关风与月。离歌且莫翻新阕，一曲能教肠寸结。直须看尽洛城花，始共春风容易别。
鹧鸪天·送人,宋代,辛弃疾 ,唱彻《阳关》泪未干，功名馀事且加餐。浮天水送无穷树，带雨云埋一半山。今古恨，几千般，只应离合是悲欢？江头未是风波恶，别有人间行路难！
鹧鸪天·桂花,宋代,李清照 ,暗淡轻黄体性柔，情疏迹远只香留。何须浅碧深红色，自是花中第一流。梅定妒，菊应羞，画阑开处冠中秋。骚人可煞无情思，何事当年不见收。
木兰春·春景,宋代,宋祁 ,东城渐觉风光好。縠皱波纹迎客棹。绿杨烟外晓寒轻，红杏枝头春意闹。浮生长恨欢娱少。肯爱千金轻一笑。为君持酒劝斜阳，且向花间留晚照。
浣溪沙·闺情,宋代,李清照 ,绣面芙蓉一笑开，斜飞宝鸭衬香腮。眼波才动被人猜。一面风情深有韵，半笺娇恨寄幽怀。月移花影约重来。
蝶恋花·暖雨晴风初破冻,宋代,李清照 ,暖雨晴风初破冻，柳眼梅腮，已觉春心动。酒意诗情谁与共？泪融残粉花钿重。乍试夹衫金缕缝，山枕斜欹，枕损钗头凤。独抱浓愁无好梦，夜阑犹剪灯花弄。
千秋岁·数声鶗鴂,宋代,张先 ,数声鶗鴂，又报芳菲歇。惜春更把残红折。雨轻风色暴，梅子青时节。永丰柳，无人尽日花飞雪。莫把幺弦拨，怨极弦能说。天不老，情难绝。心似双丝网，中有千千结。夜过也，东窗未白凝残月。
卜算子·不是爱风尘,宋代,严蕊 ,不是爱风尘，似被前缘误。花落花开自有时，总赖东君主。去也终须去，住也如何住！若得山花插满头，莫问奴归处。
湘春夜月·近清明,宋代,黄孝迈 ,近清明。翠禽枝上消魂。可惜一片清歌，都付与黄昏。欲共柳花低诉，怕柳花轻薄，不解伤春。念楚乡旅宿，柔情别绪，谁与温存。空樽夜泣，青山不语，残月当门。翠玉楼前，惟是有、一波湘水，摇荡湘云。天长梦短，问甚时、重见桃根。这次第，算人间没个并刀，剪断心上愁痕。
满庭芳·山抹微云,宋代,秦观 ,山抹微云，天连衰草，画角声断谯门。暂停征棹，聊共引离尊。多少蓬莱旧事，空回首、烟霭纷纷。斜阳外，寒鸦万点，流水绕孤村。销魂。当此际，香囊暗解，罗带轻分。谩赢得、青楼薄幸名存。此去何时见也，襟袖上、空惹啼痕。伤情处，高城望断，灯火已黄昏。
点绛唇·闺思,宋代,李清照 ,寂寞深闺，柔肠一寸愁千缕。惜春春去。几点催花雨。倚遍阑干，只是无情绪。人何处。连天衰草，望断归来路。
永遇乐·落日熔金,宋代,李清照 ,落日熔金，暮云合璧，人在何处。染柳烟浓，吹梅笛怨，春意知几许。元宵佳节，融和天气，次第岂无风雨。来相召、香车宝马，谢他酒朋诗侣。中州盛日，闺门多暇，记得偏重三五。铺翠冠儿，捻金雪柳，簇带争济楚。如今憔悴，风鬟霜鬓，怕见夜间出去。不如向、帘儿底下，听人笑语。
江城子·西城杨柳弄春柔,宋代,秦观 ,西城杨柳弄春柔，动离忧，泪难收。犹记多情、曾为系归舟。碧野朱桥当日事，人不见，水空流。韶华不为少年留，恨悠悠，几时休？飞絮落花时候、一登楼。便作春江都是泪，流不尽，许多愁。
浣溪沙·淡荡春光寒食天,宋代,李清照 ,淡荡春光寒食天，玉炉沉水袅残烟。梦回山枕隐花钿。海燕未来人斗草，江梅已过柳生绵。黄昏疏雨湿秋千。
玉蝴蝶·望处雨收云断,宋代,柳永 ,望处雨收云断，凭阑悄悄，目送秋光。晚景萧疏，堪动宋玉悲凉。水风轻，蘋花渐老，月露冷、梧叶飘黄。遣情伤。故人何在，烟水茫茫。难忘，文期酒会，几孤风月，屡变星霜。海阔山遥，未知何处是潇湘。念双燕、难凭远信，指暮天、空识归航。黯相望。断鸿声里，立尽斜阳。
玉楼春·别后不知君远近,宋代,欧阳修 ,别后不知君远近。触目凄凉多少闷。渐行渐远渐无书，水阔鱼沉何处问。夜深风竹敲秋韵。万叶千声皆是恨。故欹单枕梦中寻，梦又不成灯又烬。
