title,dynasty,poet,content
琵琶行 / 琵琶引,唐代,白居易 ,元和十年，予左迁九江郡司马。明年秋，送客湓浦口，闻舟中夜弹琵琶者，听其音，铮铮然有京都声。问其人，本长安倡女，尝学琵琶于穆、曹二善才，年长色衰，委身为贾人妇。遂命酒，使快弹数曲。曲罢悯然，自叙少小时欢乐事，今漂沦憔悴，转徙于江湖间。予出官二年，恬然自安，感斯人言，是夕始觉有迁谪意。因为长句，歌以赠之，凡六百一十六言，命曰《琵琶行》。浔阳江头夜送客，枫叶荻花秋瑟瑟。主人下马客在船，举酒欲饮无管弦。醉不成欢惨将别，别时茫茫江浸月。忽闻水上琵琶声，主人忘归客不发。寻声暗问弹者谁？琵琶声停欲语迟。移船相近邀相见，添酒回灯重开宴。千呼万唤始出来，犹抱琵琶半遮面。转轴拨弦三两声，未成曲调先有情。弦弦掩抑声声思，似诉平生不得志。低眉信手续续弹，说尽心中无限事。轻拢慢捻抹复挑，初为《霓裳》后《六幺》。大弦嘈嘈如急雨，小弦切切如私语。嘈嘈切切错杂弹，大珠小珠落玉盘。间关莺语花底滑，幽咽泉流冰下难。冰泉冷涩弦凝绝，凝绝不通声暂歇。别有幽愁暗恨生，此时无声胜有声。银瓶乍破水浆迸，铁骑突出刀枪鸣。曲终收拨当心画，四弦一声如裂帛。东船西舫悄无言，唯见江心秋月白。沉吟放拨插弦中，整顿衣裳起敛容。自言本是京城女，家在虾蟆陵下住。十三学得琵琶成，名属教坊第一部。曲罢曾教善才服，妆成每被秋娘妒。五陵年少争缠头，一曲红绡不知数。钿头银篦击节碎，血色罗裙翻酒污。今年欢笑复明年，秋月春风等闲度。弟走从军阿姨死，暮去朝来颜色故。门前冷落鞍马稀，老大嫁作商人妇。商人重利轻别离，前月浮梁买茶去。去来江口守空船，绕船月明江水寒。夜深忽梦少年事，梦啼妆泪红阑干。我闻琵琶已叹息，又闻此语重唧唧。同是天涯沦落人，相逢何必曾相识！我从去年辞帝京，谪居卧病浔阳城。浔阳地僻无音乐，终岁不闻丝竹声。住近湓江地低湿，黄芦苦竹绕宅生。其间旦暮闻何物？杜鹃啼血猿哀鸣。春江花朝秋月夜，往往取酒还独倾。岂无山歌与村笛？呕哑嘲哳难为听。今夜闻君琵琶语，如听仙乐耳暂明。莫辞更坐弹一曲，为君翻作《琵琶行》。感我此言良久立，却坐促弦弦转急。凄凄不似向前声，满座重闻皆掩泣。座中泣下谁最多？江州司马青衫湿。
走马川行奉送出师西征 / 走马川行奉送封大夫出师西征,唐代,岑参 ,君不见走马川行雪海边，平沙莽莽黄入天。轮台九月风夜吼，一川碎石大如斗，随风满地石乱走。匈奴草黄马正肥，金山西见烟尘飞，汉家大将西出师。将军金甲夜不脱，半夜军行戈相拨，风头如刀面如割。马毛带雪汗气蒸，五花连钱旋作冰，幕中草檄砚水凝。虏骑闻之应胆慑，料知短兵不敢接，车师西门伫献捷。
轮台歌奉送封大夫出师西征,唐代,岑参 ,轮台城头夜吹角，轮台城北旄头落。羽书昨夜过渠黎，单于已在金山西。戍楼西望烟尘黑，汉军屯在轮台北。上将拥旄西出征，平明吹笛大军行。四边伐鼓雪海涌，三军大呼阴山动。虏塞兵气连云屯，战场白骨缠草根。剑河风急雪片阔，沙口石冻马蹄脱。亚相勤王甘苦辛，誓将报主静边尘。古来青史谁不见，今见功名胜古人。
白雪歌送武判官归京,唐代,岑参 ,北风卷地白草折，胡天八月即飞雪。忽如一夜春风来，千树万树梨花开。散入珠帘湿罗幕，狐裘不暖锦衾薄。将军角弓不得控，都护铁衣冷难着。瀚海阑干百丈冰，愁云惨淡万里凝。中军置酒饮归客，胡琴琵琶与羌笛。纷纷暮雪下辕门，风掣红旗冻不翻。轮台东门送君去，去时雪满天山路。山回路转不见君，雪上空留马行处。
宣州谢脁楼饯别校书叔云,唐代,李白 ,弃我去者，昨日之日不可留；乱我心者，今日之日多烦忧。长风万里送秋雁，对此可以酣高楼。蓬莱文章建安骨，中间小谢又清发。俱怀逸兴壮思飞，欲上青天览明月。抽刀断水水更流，举杯销愁愁更愁。人生在世不称意，明朝散发弄扁舟。
庐山谣寄卢侍御虚舟,唐代,李白 ,我本楚狂人，凤歌笑孔丘。手持绿玉杖，朝别黄鹤楼。五岳寻仙不辞远，一生好入名山游。庐山秀出南斗傍，屏风九叠云锦张。影落明湖青黛光，金阙前开二峰长，银河倒挂三石梁。香炉瀑布遥相望，回崖沓嶂凌苍苍。翠影红霞映朝日，鸟飞不到吴天长。登高壮观天地间，大江茫茫去不还。黄云万里动风色，白波九道流雪山。好为庐山谣，兴因庐山发。闲窥石镜清我心，谢公行处苍苔没。早服还丹无世情，琴心三叠道初成。遥见仙人彩云里，手把芙蓉朝玉京。先期汗漫九垓上，愿接卢敖游太清。
梦游天姥吟留别 / 梦游天姥山别东鲁诸公,唐代,李白 ,海客谈瀛洲，烟涛微茫信难求；越人语天姥，云霞明灭或可睹。天姥连天向天横，势拔五岳掩赤城。天台四万八千丈，对此欲倒东南倾。我欲因之梦吴越，一夜飞度镜湖月。湖月照我影，送我至剡溪。谢公宿处今尚在，渌水荡漾清猿啼。脚著谢公屐，身登青云梯。半壁见海日，空中闻天鸡。千岩万转路不定，迷花倚石忽已暝。熊咆龙吟殷岩泉，栗深林兮惊层巅。云青青兮欲雨，水澹澹兮生烟。列缺霹雳，丘峦崩摧。洞天石扉，訇然中开。青冥浩荡不见底，日月照耀金银台。霓为衣兮风为马，云之君兮纷纷而来下。虎鼓瑟兮鸾回车，仙之人兮列如麻。忽魂悸以魄动，恍惊起而长嗟。惟觉时之枕席，失向来之烟霞。世间行乐亦如此，古来万事东流水。别君去兮何时还？且放白鹿青崖间，须行即骑访名山。安能摧眉折腰事权贵，使我不得开心颜！
金陵酒肆留别,唐代,李白 ,风吹柳花满店香，吴姬压酒唤客尝。金陵子弟来相送，欲行不行各尽觞。请君试问东流水，别意与之谁短长。
韩碑,唐代,李商隐 ,元和天子神武姿，彼何人哉轩与羲。誓将上雪列圣耻，坐法宫中朝四夷。淮西有贼五十载，封狼生貙貙生罴。不据山河据平地，长戈利矛日可麾。帝得圣相相曰度，贼斫不死神扶持。腰悬相印作都统，阴风惨澹天王旗。愬武古通作牙爪，仪曹外郎载笔随。行军司马智且勇，十四万众犹虎貔。入蔡缚贼献太庙，功无与让恩不訾。帝曰汝度功第一，汝从事愈宜为辞。愈拜稽首蹈且舞，金石刻画臣能为。古者世称大手笔，此事不系于职司。当仁自古有不让，言讫屡颔天子颐。公退斋戒坐小阁，濡染大笔何淋漓。点窜《尧典》《舜典》字，涂改《清庙》《生民》诗。文成破体书在纸，清晨再拜铺丹墀。表曰臣愈昧死上，咏神圣功书之碑。碑高三丈字如斗，负以灵鳌蟠以螭。句奇语重喻者少，谗之天子言其私。长绳百尺拽碑倒，粗砂大石相磨治。公之斯文若元气，先时已入人肝脾。汤盘孔鼎有述作，今无其器存其辞。呜呼圣王及圣相，相与烜赫流淳熙。公之斯文不示后，曷与三五相攀追。愿书万本诵万遍，口角流沫右手胝。传之七十有二代，以为封禅玉检明堂基。
听董大弹胡笳声兼寄语弄房给事,唐代,李颀 ,蔡女昔造胡笳声，一弹一十有八拍。胡人落泪沾边草，汉使断肠对归客。古戍苍苍烽火寒，大荒沉沉飞雪白。先拂商弦后角羽，四郊秋叶惊摵摵。董夫子，通神明，深山窃听来妖精。言迟更速皆应手，将往复旋如有情。空山百鸟散还合，万里浮云阴且晴。嘶酸雏雁失群夜，断绝胡儿恋母声。川为静其波，鸟亦罢其鸣。乌孙部落家乡远，逻娑沙尘哀怨生。幽音变调忽飘洒，长风吹林雨堕瓦。迸泉飒飒飞木末，野鹿呦呦走堂下。长安城连东掖垣，凤凰池对青琐门。高才脱略名与利，日夕望君抱琴至。
听安万善吹觱篥歌,唐代,李颀 ,南山截竹为觱篥，此乐本自龟兹出。流传汉地曲转奇，凉州胡人为我吹。傍邻闻者多叹息，远客思乡皆泪垂。世人解听不解赏，长飙风中自来往。枯桑老柏寒飕飗，九雏鸣凤乱啾啾。龙吟虎啸一时发，万籁百泉相与秋。忽然更作渔阳掺，黄云萧条白日暗。变调如闻杨柳春，上林繁花照眼新。岁夜高堂列明烛，美酒一杯声一曲。
古意,唐代,李颀 ,男儿事长征，少小幽燕客。赌胜马蹄下，由来轻七尺。杀人莫敢前，须如猬毛磔。黄云陇底白云飞，未得报恩不能归。辽东小妇年十五，惯弹琵琶解歌舞。今为羌笛出塞声，使我三军泪如雨。
送陈章甫,唐代,李颀 ,四月南风大麦黄，枣花未落桐叶长。青山朝别暮还见，嘶马出门思旧乡。陈侯立身何坦荡，虬须虎眉仍大颡。腹中贮书一万卷，不肯低头在草莽。东门酤酒饮我曹，心轻万事如鸿毛。醉卧不知白日暮，有时空望孤云高。长河浪头连天黑，津口停舟渡不得。郑国游人未及家，洛阳行子空叹息。闻道故林相识多，罢官昨日今如何。
琴歌,唐代,李颀 ,主人有酒欢今夕，请奏鸣琴广陵客。月照城头乌半飞，霜凄万树风入衣。铜炉华烛烛增辉，初弹渌水后楚妃。一声已动物皆静，四座无言星欲稀。清淮奉使千馀里，敢告云山从此始。
古柏行,唐代,杜甫 ,孔明庙前有老柏，柯如青铜根如石。霜皮溜雨四十围，黛色参天二千尺。君臣已与时际会，树木犹为人爱惜。云来气接巫峡长，月出寒通雪山白。忆昨路绕锦亭东，先主武侯同閟宫。崔嵬枝干郊原古，窈窕丹青户牖空。落落盘踞虽得地，冥冥孤高多烈风。扶持自是神明力，正直原因造化工。大厦如倾要梁栋，万牛回首丘山重。不露文章世已惊，未辞翦伐谁能送？苦心岂免容蝼蚁，香叶终经宿鸾凤。志士幽人莫怨嗟：古来材大难为用。
观公孙大娘弟子舞剑器行,唐代,杜甫 ,大历二年十月十九日，夔府别驾元持宅，见临颍李十二娘舞剑器，壮其蔚跂，问其所师，曰：“余公孙大娘弟子也。”开元五载，余尚童稚，记于郾城观公孙氏，舞剑器浑脱，浏漓顿挫，独出冠时，自高头宜春梨园二伎坊内人洎外供奉，晓是舞者，圣文神武皇帝初，公孙一人而已。玉貌锦衣，况余白首，今兹弟子，亦非盛颜。既辨其由来，知波澜莫二，抚事慷慨，聊为《剑器行》。昔者吴人张旭，善草书帖，数常于邺县见公孙大娘舞西河剑器，自此草书长进，豪荡感激，即公孙可知矣。昔有佳人公孙氏，一舞剑器动四方。观者如山色沮丧，天地为之久低昂。霍如羿射九日落，矫如群帝骖龙翔。来如雷霆收震怒，罢如江海凝清光。绛唇珠袖两寂寞，晚有弟子传芬芳。临颍美人在白帝，妙舞此曲神扬扬。与余问答既有以，感时抚事增惋伤。先帝侍女八千人，公孙剑器初第一。五十年间似反掌，风尘倾动昏王室。梨园弟子散如烟，女乐余姿映寒日。金粟堆前木已拱，瞿唐石城草萧瑟。玳筵急管曲复终，乐极哀来月东出。老夫不知其所往，足茧荒山转愁疾。
韦讽录事宅观曹将军画马图,唐代,杜甫 ,国初已来画鞍马，神妙独数江都王。将军得名三十载，人间又见真乘黄。曾貌先帝照夜白，龙池十日飞霹雳。内府殷红玛瑙盘，婕妤传诏才人索。盘赐将军拜舞归，轻纨细绮相追飞。贵戚权门得笔迹，始觉屏障生光辉。昔日太宗拳毛騧，近时郭家狮子花。今之新图有二马，复令识者久叹嗟。此皆骑战一敌万，缟素漠漠开风沙。其余七匹亦殊绝，迥若寒空动烟雪。霜蹄蹴踏长楸间，马官厮养森成列。可怜九马争神骏，顾视清高气深稳。借问苦心爱者谁，后有韦讽前支遁。忆昔巡幸新丰宫，翠华拂天来向东。腾骧磊落三万匹，皆与此图筋骨同。自从献宝朝河宗，无复射蛟江水中。君不见金粟堆前松柏里，龙媒去尽鸟呼风。
丹青引赠曹将军霸,唐代,杜甫 ,将军魏武之子孙，于今为庶为清门。英雄割据虽已矣，文采风流今尚存。学书初学卫夫人，但恨无过王右军。丹青不知老将至，富贵于我如浮云。开元之中常引见，承恩数上南薰殿。凌烟功臣少颜色，将军下笔开生面。良相头上进贤冠，猛将腰间大羽箭。褒公鄂公毛发动，英姿飒爽来酣战。先帝御马五花骢，画工如山貌不同。是日牵来赤墀下，迥立阊阖生长风。诏谓将军拂绢素，意匠惨澹经营中。斯须九重真龙出，一洗万古凡马空。玉花却在御榻上，榻上庭前屹相向。至尊含笑催赐金，圉人太仆皆惆怅。弟子韩干早入室，亦能画马穷殊相。干惟画肉不画骨，忍使骅骝气凋丧。将军画善盖有神，必逢佳士亦写真。即今漂泊干戈际，屡貌寻常行路人。途穷反遭俗眼白，世上未有如公贫。但看古来盛名下，终日坎壈缠其身。
寄韩谏议注,唐代,杜甫 ,今我不乐思岳阳，身欲奋飞病在床。美人娟娟隔秋水，濯足洞庭望八荒。鸿飞冥冥日月白，青枫叶赤天雨霜。玉京群帝集北斗，或骑麒麟翳凤凰。芙蓉旌旗烟雾落，影动倒景摇潇湘。星宫之君醉琼浆，羽人稀少不在旁。似闻昨者赤松子，恐是汉代韩张良。昔随刘氏定长安，帷幄未改神惨伤。国家成败吾岂敢，色难腥腐餐枫香。周南留滞古所惜，南极老人应寿昌。美人胡为隔秋水，焉得置之贡玉堂。
夜归鹿门山歌 / 夜归鹿门歌,唐代,孟浩然 ,山寺钟鸣昼已昏，渔梁渡头争渡喧。人随沙岸向江村，余亦乘舟归鹿门。鹿门月照开烟树，忽到庞公栖隐处。岩扉松径长寂寥，惟有幽人自来去。
渔翁,唐代,柳宗元 ,渔翁夜傍西岩宿，晓汲清湘燃楚竹。烟销日出不见人，欸乃一声山水绿。回看天际下中流，岩上无心云相逐。
登幽州台歌,唐代,陈子昂 ,前不见古人，后不见来者。念天地之悠悠，独怆然而涕下。
石鼓歌,唐代,韩愈 ,张生手持石鼓文，劝我试作石鼓歌。少陵无人谪仙死，才薄将奈石鼓何。周纲凌迟四海沸，宣王愤起挥天戈。大开明堂受朝贺，诸侯剑佩鸣相磨。蒐于岐阳骋雄俊，万里禽兽皆遮罗。镌功勒成告万世，凿石作鼓隳嵯峨。从臣才艺咸第一，拣选撰刻留山阿。雨淋日灸野火燎，鬼物守护烦撝呵。公从何处得纸本，毫发尽备无差讹。辞严义密读难晓，字体不类隶与蝌。年深岂免有缺画，快剑斫断生蛟鼍。鸾翔凤翥众仙下，珊瑚碧树交枝柯。金绳铁索锁钮壮，古鼎跃水龙腾梭。陋儒编诗不收入，二雅褊迫无委蛇。孔子西行不到秦，掎摭星宿遗羲娥。嗟余好古生苦晚，对此涕泪双滂沱。忆昔初蒙博士征，其年始改称元和。故人从军在右辅，为我度量掘臼科。濯冠沐浴告祭酒，如此至宝存岂多。毡包席裹可立致，十鼓只载数骆驼。荐诸太庙比郜鼎，光价岂止百倍过。圣恩若许留太学，诸生讲解得切磋。观经鸿都尚填咽，坐见举国来奔波。剜苔剔藓露节角，安置妥帖平不颇。大厦深檐与盖覆，经历久远期无佗。中朝大官老于事，讵肯感激徒媕婀。牧童敲火牛砺角，谁复著手为摩挲。日销月铄就埋没，六年西顾空吟哦。羲之俗书趁姿媚，数纸尚可博白鹅。继周八代争战罢，无人收拾理则那。方今太平日无事，柄任儒术崇丘轲。安能以此尚论列，愿借辩口如悬河。石鼓之歌止于此，呜呼吾意其蹉跎。
山石,唐代,韩愈 ,山石荦确行径微，黄昏到寺蝙蝠飞。升堂坐阶新雨足，芭蕉叶大栀子肥。僧言古壁佛画好，以火来照所见稀。铺床拂席置羹饭，疏粝亦足饱我饥。夜深静卧百虫绝，清月出岭光入扉。天明独去无道路，出入高下穷烟霏。山红涧碧纷烂漫，时见松枥皆十围。当流赤足踏涧石，水声激激风吹衣。人生如此自可乐，岂必局束为人鞿？嗟哉吾党二三子，安得至老不更归。
八月十五夜赠张功曹,唐代,韩愈 ,纤云四卷天无河，清风吹空月舒波。沙平水息声影绝，一杯相属君当歌。君歌声酸辞且苦，不能听终泪如雨。洞庭连天九疑高，蛟龙出没猩鼯号。十生九死到官所，幽居默默如藏逃。下床畏蛇食畏药，海气湿蛰熏腥臊。昨者州前捶大鼓，嗣皇继圣登夔皋。赦书一日行万里，罪从大辟皆除死。迁者追回流者还，涤瑕荡垢清朝班。州家申名使家抑，坎轲只得移荆蛮。判司卑官不堪说，未免捶楚尘埃间。同时辈流多上道，天路幽险难追攀。君歌且休听我歌，我歌今与君殊科。一年明月今宵多，人生由命非由他。有酒不饮奈明何。
谒衡岳庙遂宿岳寺题门楼,唐代,韩愈 ,五岳祭秩皆三公，四方环镇嵩当中。火维地荒足妖怪，天假神柄专其雄。喷云泄雾藏半腹，虽有绝顶谁能穷？我来正逢秋雨节，阴气晦昧无清风。潜心默祷若有应，岂非正直能感通！须臾静扫众峰出，仰见突兀撑青空。紫盖连延接天柱，石廪腾掷堆祝融。森然魄动下马拜，松柏一径趋灵宫。粉墙丹柱动光彩，鬼物图画填青红。升阶伛偻荐脯酒，欲以菲薄明其衷。庙令老人识神意，睢盱侦伺能鞠躬。手持杯珓导我掷，云此最吉余难同。窜逐蛮荒幸不死，衣食才足甘长终。侯王将相望久绝，神纵欲福难为功。夜投佛寺上高阁，星月掩映云曈昽。猿鸣钟动不知曙，杲杲寒日生于东。
凉州词二首·其一,唐代,王之涣 ,黄河远上白云间，一片孤城万仞山。羌笛何须怨杨柳，春风不度玉门关。
出塞二首·其一,唐代,王昌龄 ,秦时明月汉时关，万里长征人未还。但使龙城飞将在，不教胡马度阴山。
塞上曲·其一,唐代,王昌龄 ,蝉鸣空桑林，八月萧关道。出塞入塞寒，处处黄芦草。从来幽并客，皆共尘沙老。莫学游侠儿，矜夸紫骝好。
塞下曲,唐代,王昌龄 ,饮马渡秋水，水寒风似刀。平沙日未没，黯黯见临洮。昔日长城战，咸言意气高。黄尘足今古，白骨乱蓬蒿。
长信怨,唐代,王昌龄 ,金井梧桐秋叶黄，珠帘不卷夜来霜。熏笼玉枕无颜色，卧听南宫清漏长。高殿秋砧响夜阑，霜深犹忆御衣寒。银灯青琐裁缝歇，还向金城明主看。奉帚平明金殿开，暂将团扇共徘徊。玉颜不及寒鸦色，犹带昭阳日影来。真成薄命久寻思，梦见君王觉后疑。火照西宫知夜饮，分明复道奉恩时。长信宫中秋月明，昭阳殿下捣衣声。白露堂中细草迹，红罗帐里不胜情。
送元二使安西 / 渭城曲,唐代,王维 ,渭城朝雨浥轻尘，客舍青青柳色新。劝君更尽一杯酒，西出阳关无故人。
秋夜曲,唐代,王维 ,桂魄初生秋露微，轻罗已薄未更衣。银筝夜久殷勤弄，心怯空房不忍归。
洛阳女儿行,唐代,王维 ,洛阳女儿对门居，才可颜容十五余。良人玉勒乘骢马，侍女金盘脍鲤鱼。画阁朱楼尽相望，红桃绿柳垂檐向。罗帷送上七香车，宝扇迎归九华帐。狂夫富贵在青春，意气骄奢剧季伦。自怜碧玉亲教舞，不惜珊瑚持与人。春窗曙灭九微火，九微片片飞花琐。戏罢曾无理曲时，妆成祗是熏香坐。城中相识尽繁华，日夜经过赵李家。谁怜越女颜如玉，贫贱江头自浣纱。
老将行,唐代,王维 ,少年十五二十时，步行夺得胡马骑。射杀山中白额虎，肯数邺下黄须儿！一身转战三千里，一剑曾当百万师。汉兵奋迅如霹雳，虏骑崩腾畏蒺藜。卫青不败由天幸，李广无功缘数奇。自从弃置便衰朽，世事蹉跎成白首。昔时飞箭无全目，今日垂杨生左肘。路旁时卖故侯瓜，门前学种先生柳。苍茫古木连穷巷，寥落寒山对虚牖。誓令疏勒出飞泉，不似颍川空使酒。贺兰山下阵如云，羽檄交驰日夕闻。节使三河募年少，诏书五道出将军。试拂铁衣如雪色，聊持宝剑动星文。愿得燕弓射大将，耻令越甲鸣吾君。莫嫌旧日云中守，犹堪一战取功勋。
桃源行,唐代,王维 ,渔舟逐水爱山春，两岸桃花夹古津。坐看红树不知远，行尽青溪不见人。山口潜行始隈隩，山开旷望旋平陆。遥看一处攒云树，近入千家散花竹。樵客初传汉姓名，居人未改秦衣服。居人共住武陵源，还从物外起田园。月明松下房栊静，日出云中鸡犬喧。惊闻俗客争来集，竞引还家问都邑。平明闾巷扫花开，薄暮渔樵乘水入。初因避地去人间，及至成仙遂不还。峡里谁知有人事，世中遥望空云山。不疑灵境难闻见，尘心未尽思乡县。出洞无论隔山水，辞家终拟长游衍。自谓经过旧不迷，安知峰壑今来变。当时只记入山深，青溪几度到云林。春来遍是桃花水，不辨仙源何处寻。
清平调·其一,唐代,李白 ,云想衣裳花想容，春风拂槛露华浓。若非群玉山头见，会向瑶台月下逢。
清平调·其二,唐代,李白 ,一枝红艳露凝香，云雨巫山枉断肠。借问汉宫谁得似，可怜飞燕倚新妆。
清平调·名花倾国两相欢,唐代,李白 ,名花倾国两相欢，常得君王带笑看。解释春风无限恨，沉香亭北倚栏杆。
行路难·其一,唐代,李白 ,金樽清酒斗十千，玉盘珍羞直万钱。停杯投箸不能食，拔剑四顾心茫然。欲渡黄河冰塞川，将登太行雪满山。闲来垂钓碧溪上，忽复乘舟梦日边。行路难！行路难！多歧路，今安在？长风破浪会有时，直挂云帆济沧海。
行路难·其二,唐代,李白 ,大道如青天，我独不得出。羞逐长安社中儿，赤鸡白雉赌梨栗。弹剑作歌奏苦声，曳裾王门不称情。淮阴市井笑韩信，汉朝公卿忌贾生。君不见昔时燕家重郭隗，拥篲折节无嫌猜。剧辛乐毅感恩分，输肝剖胆效英才。昭王白骨萦蔓草，谁人更扫黄金台？行路难，归去来！
行路难·其三,唐代,李白 ,有耳莫洗颍川水，有口莫食首阳蕨。含光混世贵无名，何用孤高比云月？吾观自古贤达人，功成不退皆殒身。子胥既弃吴江上，屈原终投湘水滨。陆机雄才岂自保？李斯税驾苦不早。华亭鹤唳讵可闻？上蔡苍鹰何足道？君不见吴中张翰称达生，秋风忽忆江东行。且乐生前一杯酒，何须身后千载名？
将进酒,唐代,李白 ,君不见，黄河之水天上来，奔流到海不复回。君不见，高堂明镜悲白发，朝如青丝暮成雪。人生得意须尽欢，莫使金樽空对月。天生我材必有用，千金散尽还复来。烹羊宰牛且为乐，会须一饮三百杯。岑夫子，丹丘生，将进酒，杯莫停。与君歌一曲，请君为我倾耳听。钟鼓馔玉不足贵，但愿长醉不复醒。古来圣贤皆寂寞，惟有饮者留其名。陈王昔时宴平乐，斗酒十千恣欢谑。主人何为言少钱，径须沽取对君酌。五花马，千金裘，呼儿将出换美酒，与尔同销万古愁。
玉阶怨,唐代,李白 ,玉阶生白露，夜久侵罗袜。却下水晶帘，玲珑望秋月。
长相思·其一,唐代,李白 ,长相思，在长安。络纬秋啼金井阑，微霜凄凄簟色寒。孤灯不明思欲绝，卷帷望月空长叹。美人如花隔云端！上有青冥之长天，下有渌水之波澜。天长路远魂飞苦，梦魂不到关山难。长相思，摧心肝！
长相思·其二,唐代,李白 ,日色欲尽花含烟，月明欲素愁不眠。赵瑟初停凤凰柱，蜀琴欲奏鸳鸯弦。此曲有意无人传，愿随春风寄燕然。忆君迢迢隔青天，昔日横波目，今作流泪泉。不信妾断肠，归来看取明镜前。
长干行·其一,唐代,李白 ,妾发初覆额，折花门前剧。郎骑竹马来，绕床弄青梅。同居长干里，两小无嫌猜，十四为君妇，羞颜未尝开。低头向暗壁，千唤不一回。十五始展眉，愿同尘与灰。常存抱柱信，岂上望夫台。十六君远行，瞿塘滟滪堆。五月不可触，猿声天上哀。门前迟行迹，一一生绿苔。苔深不能扫，落叶秋风早。八月蝴蝶来，双飞西园草。感此伤妾心，坐愁红颜老。早晚下三巴，预将书报家。相迎不道远，直至长风沙。
